<?xml version="1.0" encoding="UTF-8"?>
<!DOCTYPE Category SYSTEM "asterix.dtd">

<!--  

	Mode S BDS registers definition 
	
	Author:   dsalantic
	Created:  5.5.2016.
	

--> 

<Category id="BDS" name="BDS" ver="1.0">
	
	<DataItem id="40">
		<DataItemName>Selected vertical intention</DataItemName>
		<DataItemDefinition>Selected vertical intention</DataItemDefinition>
		<DataItemFormat desc="Seven-octets fixed length data item.">
			<Fixed length="7">
				<Bits bit="56">
					<BitsShortName>MCP_ALT_STATUS</BitsShortName>
					<BitsName>MCP Altitude Status</BitsName>
				</Bits>
				<Bits from="55" to="44" encode="unsigned">
					<BitsShortName>MCP_ALT</BitsShortName>
					<BitsName>MCP/FCU Selected Altitude</BitsName>
                    <BitsUnit scale="16">ft</BitsUnit>
				</Bits>
				<Bits bit="43">
					<BitsShortName>FMS_ALT_STATUS</BitsShortName>
					<BitsName>FMS Altitude Status</BitsName>
				</Bits>
				<Bits from="42" to="31" encode="unsigned">
					<BitsShortName>FMS_ALT</BitsShortName>
					<BitsName>FMS Selected Altitude</BitsName>
                    <BitsUnit scale="16">ft</BitsUnit>
				</Bits>
				<Bits bit="30">
					<BitsShortName>BP_STATUS</BitsShortName>
					<BitsName>Barometric Pressure Status</BitsName>
				</Bits>
				<Bits from="29" to="18" encode="unsigned">
					<BitsShortName>BP</BitsShortName>
					<BitsName>Barometric Pressure</BitsName>
                    <BitsUnit scale="0.1">mb</BitsUnit>
				</Bits>
				<Bits from="17" to="10">
					<BitsShortName>res</BitsShortName>
					<BitsName>Reserved</BitsName>
				</Bits>
				<Bits bit="9">
					<BitsShortName>MODE_STATUS</BitsShortName>
					<BitsName>Status of MCP/FCU Mode Bits</BitsName>
				</Bits>
                <Bits bit="8">
                    <BitsShortName>VNAV</BitsShortName>
					<BitsName>VNAV Mode</BitsName>
                    <BitsValue val="0">Not active</BitsValue>
                    <BitsValue val="1">Active</BitsValue>
                </Bits>
                <Bits bit="7">
                    <BitsShortName>ALTHOLD</BitsShortName>
					<BitsName>ALT HOLD Mode</BitsName>
                    <BitsValue val="0">Not active</BitsValue>
                    <BitsValue val="1">Active</BitsValue>
                </Bits>
                <Bits bit="6">
                    <BitsShortName>APPMODE</BitsShortName>
					<BitsName>APPROACH Mode</BitsName>
                    <BitsValue val="0">Not active</BitsValue>
                    <BitsValue val="1">Active</BitsValue>
                </Bits>
				<Bits from="5" to="4">
					<BitsShortName>res</BitsShortName>
					<BitsName>Reserved</BitsName>
				</Bits>
                <Bits bit="3">
                    <BitsShortName>TARGETALTSTAT</BitsShortName>
					<BitsName>Status of Target ALT source bits</BitsName>
                    <BitsValue val="0">No source information provided</BitsValue>
                    <BitsValue val="1">Source information deliberately provided</BitsValue>
                </Bits>
                <Bits from="2" to="1">
                    <BitsShortName>TARGETALTSRC</BitsShortName>
					<BitsName>Target ALT source</BitsName>
                    <BitsValue val="0">Unknown</BitsValue>
                    <BitsValue val="1">Aircraft Altitude</BitsValue>
                    <BitsValue val="0">FCU/MCP selected altitude</BitsValue>
                    <BitsValue val="1">FMS selected altitude</BitsValue>
                </Bits>
			</Fixed>
		</DataItemFormat>
	</DataItem>

	<DataItem id="50">
		<DataItemName>Track and turn report</DataItemName>
		<DataItemDefinition>Track and turn report</DataItemDefinition>
		<DataItemFormat desc="Seven-octets fixed length data item.">
			<Fixed length="7">
				<Bits bit="56">
					<BitsShortName>ROLL_STATUS</BitsShortName>
					<BitsName>Roll Angle Status</BitsName>
				</Bits>
				<Bits bit="55">
					<BitsShortName>ROLL_SIGN_DIR</BitsShortName>
					<BitsName>Roll Angle Direction</BitsName>
                    <BitsValue val="0">Right wing down</BitsValue>
                    <BitsValue val="1">Left wing down</BitsValue>
				</Bits>
				<Bits from="54" to="46" encode="signed">
					<BitsShortName>ROLL_ANGLE</BitsShortName>
					<BitsName>Roll angle</BitsName>
                    <BitsUnit scale="0.17578125">deg</BitsUnit>
				</Bits>
				<Bits bit="45">
					<BitsShortName>TRUE_TRACK_STATUS</BitsShortName>
					<BitsName>True Track Angle Status</BitsName>
				</Bits>
				<Bits bit="44">
					<BitsShortName>TRUE_TRACK_ANGLE_DIR</BitsShortName>
					<BitsName>True Track Angle Direction</BitsName>
                    <BitsValue val="0">East</BitsValue>
                    <BitsValue val="1">West</BitsValue>
				</Bits>
				<Bits from="43" to="34" encode="signed">
					<BitsShortName>TRU_TRACK_ANGLE</BitsShortName>
					<BitsName>True track angle</BitsName>
                    <BitsUnit scale="0.17578125">deg</BitsUnit>
				</Bits>
				<Bits bit="33">
					<BitsShortName>GS_STATUS</BitsShortName>
					<BitsName>Ground Speed Status</BitsName>
				</Bits>
				<Bits from="32" to="23" encode="unsigned">
					<BitsShortName>GS</BitsShortName>
					<BitsName>Ground Speed</BitsName>
                    <BitsUnit scale="2">kt</BitsUnit>
				</Bits>
				<Bits bit="22">
					<BitsShortName>TRACK_ANGLE_RATE_STATUS</BitsShortName>
					<BitsName>Track Angle Rate Status</BitsName>
				</Bits>
				<Bits bit="21">
					<BitsShortName>TRACK_ANGLE_RATE_SIGN</BitsShortName>
					<BitsName>Track Angle Rate Sign</BitsName>
                    <BitsValue val="0">Plus</BitsValue>
                    <BitsValue val="1">Minus</BitsValue>
				</Bits>
				<Bits from="20" to="12" encode="signed">
					<BitsShortName>TRACK_ANGLE_RATE</BitsShortName>
					<BitsName>Track angle rate</BitsName>
                    <BitsUnit scale="0.03125">deg/sec</BitsUnit>
				</Bits>
				<Bits bit="11">
					<BitsShortName>TAS_STATUS</BitsShortName>
					<BitsName>True Airspeed Status</BitsName>
				</Bits>
				<Bits from="10" to="1" encode="signed">
					<BitsShortName>TAS</BitsShortName>
					<BitsName>True Airspeed</BitsName>
                    <BitsUnit scale="2">kt</BitsUnit>
				</Bits>
			</Fixed>
		</DataItemFormat>
	</DataItem>

	<DataItem id="60">
		<DataItemName>Heading and Speed Report</DataItemName>
		<DataItemDefinition>Heading and Speed Report</DataItemDefinition>
		<DataItemFormat desc="Seven-octets fixed length data item.">
			<Fixed length="7">
				<Bits bit="56">
					<BitsShortName>HDG_STAT</BitsShortName>
					<BitsName>Heading Status</BitsName>
				</Bits>
				<Bits bit="55">
					<BitsShortName>HDG_DIR</BitsShortName>
					<BitsName>Head Direction</BitsName>
                    <BitsValue val="0">East</BitsValue>
                    <BitsValue val="1">West</BitsValue>
				</Bits>
				<Bits from="54" to="45" encode="unsigned">
					<BitsShortName>HDG</BitsShortName>
					<BitsName>Magnetic Heading</BitsName>
                    <BitsUnit scale="0.17578125">deg</BitsUnit>
				</Bits>
				<Bits bit="44">
					<BitsShortName>IAS_STAT</BitsShortName>
					<BitsName>Indicated Airspeed Status</BitsName>
				</Bits>
				<Bits from="43" to="34">
					<BitsShortName>IAS</BitsShortName>
					<BitsName>Indicated Airspeed</BitsName>
                    <BitsUnit scale="1">kt</BitsUnit>
				</Bits>
				<Bits bit="33">
					<BitsShortName>MACH_STAT</BitsShortName>
					<BitsName>Mach Speed Status</BitsName>
				</Bits>
				<Bits from="32" to="23">
					<BitsShortName>MACH</BitsShortName>
					<BitsName>Mach Speed</BitsName>
                    <BitsUnit scale=".004">MACH</BitsUnit>
				</Bits>
				<Bits bit="22">
					<BitsShortName>BAR_STAT</BitsShortName>
					<BitsName>Barometric Altitude Rate Status</BitsName>
				</Bits>
				<Bits bit="21">
					<BitsShortName>BAR_DIR</BitsShortName>
					<BitsName>Barometric Altitude Rate Direction</BitsName>
                    <BitsValue val="0">Above</BitsValue>
                    <BitsValue val="1">Below</BitsValue>
				</Bits>
				<Bits from="20" to="12" encode="unsigned">
					<BitsShortName>BAR</BitsShortName>
					<BitsName>Barometric Altitude Rate</BitsName>
                    <BitsUnit scale="32">ft/min</BitsUnit>
				</Bits>
				<Bits bit="11">
					<BitsShortName>IVV_STAT</BitsShortName>
					<BitsName>Inertial Vertical Velocity Status</BitsName>
				</Bits>
				<Bits from="10" to="1" encode="unsigned">
					<BitsShortName>IVV</BitsShortName>
					<BitsName>Inertial Vertical Velocity </BitsName>
                    <BitsUnit scale="32">ft/min</BitsUnit>
				</Bits>
			</Fixed>
		</DataItemFormat>
	</DataItem>

	<DataItem id="00"> <!-- This must be last item  -->
		<DataItemName>BDS register</DataItemName>
		<DataItemDefinition>BDS register</DataItemDefinition>
		<DataItemFormat desc="Seven-octets fixed length data item.">
			<Fixed length="7">
				<Bits from="56" to="1" encode="hex">
					<BitsShortName>BDS</BitsShortName>
					<BitsName>BDS value</BitsName>
				</Bits>
			</Fixed>
		</DataItemFormat>
	</DataItem>
    
 </Category>				    
